English,Hindi,Hinglish
So first thing is I have pressure from inside,तो सबसे पहले मैं अंदर से दबाव है,So first thing is I have pressure हमला
Were gonna donate it to the HunterSeven Foundation,यह केमरे सात आधार के लिए दान करने वाला था,Were gonna donate it to the यह पागलपन है
Welcome to the outside world,बाहर दुनिया में आपका स्वागत है,Welcome to the outside कर रहे हैं
you know what I think this building over,तुम्हें पता है मैं इस इमारत पर क्या लगता है,you know what I think अधिक
And that his injured friends were at the crash site,और कि उसके घायल मित्र दुर्घटना स्थल पर थे,And that his injured friends were at बड़ा ठीक
So the phone that I have been using in 2023,मैं 2023 में इस्तेमाल किया गया है कि फोन,So the phone that I have been using संभव
If you have watched the film Ford v Ferrari,अगर आपने फिल्म को यूँ ही देखा है तो वीररी,If you have watched the film Ford कारों की दर्जनों कारों
Sadhguru No no no nobody said that,कोई भी नहीं कहा कि,Sadhguru No no no nobody said भारत
And the conclusion of this was that,और इसका निष्कर्ष यह था कि,And the conclusion of संख्या छोड़ें
It takes longer than 10 hours,यह 10 घंटे से अधिक लेता है,It takes longer than 10 गार्ड
Youre scaring me Calm down!,तुम मुझे शांत कर रहे हैं!,Youre scaring me एल
did not turn out to be as dangerous and fatal,यह खतरनाक और जानलेवा नहीं था,did not turn out to be as क्या करना है?
Or is it the iPhone 11 and the 12?,या यह मैंफोन 11 और 12 है?,Or is it the iPhone 11 घटना
People will say lets talk about Elon Musk for example we,लोग कहते हैं कि हम उदाहरण के लिए एलॉन विस्क के बारे में बात करते हैं,People will say lets talk about Elon Musk for example उतरने का स्थान
he can make them say whatever he wants Jimmy,वह उन्हें कह सकता है कि वह जिमी चाहता है क्या कह सकते हैं,he can make them say whatever he धर्म
which determines the extent of hillcutting,जो पहाड़ी छितराने की सीमा निर्धारित करता है,which determines the ओक
Some exercises obviously burn more calories than others,कुछ लोग स्पष्ट रूप से अन्यों से ज़्यादा प्रोटीन जलाते हैं,Some exercises obviously burn more calories than आपूर्ति
On the other hand the Indian air traffic controllers,दूसरी ओर भारतीय हवाई यातायात नियंत्रण,On the other hand the Indian air traffic एक प्रोफेसर
Because I bring such videos on the daily basis,क्योंकि मैं दैनिक आधार पर इस तरह के वीडियो लाता हूँ,"Because I bring such videos on the daily और अपनी पत्नियों से,"
Yeah and on top of that,हाँ और उस के शीर्ष पर,Yeah and on top और अधिक की जरूरत है?
in top tech companies like Google Facebook,गूगल फेसबुक की तरह शीर्ष तकनीकों में,in top tech companies हथियार बेचने से
and it has over 50 crew members,और यह 50 से अधिक दल सदस्यों से अधिक है,and it has over 50 जैसे?
Looking good in here looking real good,यहाँ में अच्छा देख रहे हैं असली अच्छा लग रहा है,Looking good in here looking real नया एफगान साम्राज्य
And so the test was delayed by a day,और इस तरह की परीक्षा एक दिन के बाद घटित हुई,And so the test was delayed by a यूट्यूब चैनल स्वयं
where world leaders and presidents take their vacation,जहाँ विश्‍व नेताओं और राष्ट्रपति अपनी छुट्टी लेते हैं,where world leaders and presidents take their भारतीय सेनाएं
Thats What the Tech? Im,यह टेक क्या है?,Thats What the Tech? कम मूल्य
a third or a four year plan after they,एक तीसरे या चार वर्ष के बाद योजना बनाई,a third or a four year पृथ्वी पर खनिज
Do you know the Worlds Biggest Fish YouTuber?,क्या आप विश्‍व भर में बड़े पैमाने पर मछली यूट्यूबर जानते हैं?,Do you know the Worlds Biggest गहरा लगाव
were bringing back his biggest nightmare,अपने सबसे बड़े सपना को वापस ला रहे थे,were bringing back his biggest इसपेटे में
A person will die of suffocation but this guy always keeps the top collar button closed,एक व्यक्ति cloclocing के मरने पर होगा लेकिन इस आदमी हमेशा ऊपर कॉलर बटन बंद रहता है,A person will die of suffocation but this guy always keeps the top भविष्य
that it was beyond anybodys imagination,कि वह (जहन्नुम) भी एक बहुत बड़ी (आफ़त) थी,that it was अविश्वसनीय ठोस
Bro you dont be searching into ice cream lure bro?,आप आइसक्रीम में खोज नहीं किया जा सकता भाई?,Bro you dont be searching into ice cream कि वास्तव में हुआ था
teaching them youre planting seeds,उन्हें बीज बोने के लिए सिखाना,teaching them youre प्रथम आकाशीय
Lets see how presidents travel Come on in,अध्यक्ष कैसे यात्रा करते हैं देखते हैं,Lets see how presidents travel Come पहले
of what you should not do,जो तुम नहीं करना चाहिए,of what you था
the people of other religions are not kafirs,दूसरे धर्मों के लोग भी इस तरह के नहीं हैं ।,the people of other religions are यह भी बच गया
Guys we dont need Chris,दोस्तों हम क्रिस की जरूरत नहीं है,Guys we पेंटिंग
And thats why the photos and videos are very bad,और यही कारण है कि फोटो और वीडियो बहुत बुरा हैं,And thats why the photos and videos are एक मुफ्त सत्र
Its a hole  With a tree in it,"उसमें एक वृक्ष का प्रविष्ट होगा,",Its a hole With a tree ज़रूरतमंद
and remained unaware of what was happening in the world around him,हालाँकि जो कुछ उसके पास है वह सरकश हो गया है,and remained unaware of what was happening in the दूसरी औरत
When they ask questions their brain uses those memories and images to respond,जब वे सवाल पूछते हैं तो उनके दिमाग में उन यादों और तसवीरों का इस्तेमाल करके जवाब दिया जाता है,When they ask questions their brain uses those memories and कि
We did not have it And we know that situation,हमारे पास यह नहीं था और हम जानते हैं कि स्थिति,We did not have it And we know श्रेणी
It accidentally fell down during repair,वह शायद मरम्मत के दौरान गिर गयी,It accidentally fell सिर्फ पौराणिक कथाओं
In contrast passive sonar does not emit sound,स्पष्ट रूप से देखे गए पुत्र की आवाज़ में ध्वनि नहीं निकाली जाती है,In contrast passive sonar does मनुष्यों में से
How the Taj Mahal was built,ताज महल कैसे बनाया गया,How the Taj निकालें
All these things that I say,ये सब बातें जो मैं कहता हूं,All these things सुरक्षित
If you compare the phone from 3 years ago with the phone from 3 years ago then its,अगर आप 3 साल पहले फोन की तुलना 3 साल पहले से करते हैं तो इसका,If you compare the phone from 3 years ago with the phone from 3 years ago then यहाँ
after you eat a bunch of pizza,तुम्हारे बाद जहन्नुमी का एक गुच्छा खाओ,after you eat a असल में गहरी बातचीत
Minimum 3000 to 4000 GB data,न्यूनतम 3000 से 4000 GB डाटा,Minimum 3000 to यह है
Thank you so much for watching,देखने के लिए इतना धन्यवाद,Thank you so much थोड़ा सा इंतजार करें
At the end of this movie,इस फिल्म के आखिर में,At the end of दावा करते हैं कि
All right There he is go go go go,ठीक है वह जा रहा है वहाँ जाओ,All right There he is go go उसके बारे में
This is why the light scattered in all directions,इसी कारण ज्योति सब दिशाओं में तितर - बितर होती है,This is why the light scattered in भी आयोजित किया जा रहा है
Your input this fabric you import from Japan that guy,अपने इनपुट इस कपड़े आप जापान से आयात करता है कि आदमी,Your input this fabric you import from Japan किनारे
cheezein hain hoon and ya light aayi hai aur coffee aagayi,क्लोसोन होन और फिर एक्गे कॉफी की रोशनी,cheezein hain hoon and ya light aayi hai aur coffee एक
on one day outta the year,वर्ष से एक दिन,on one day विपत्ति
I rented an entire museum have dozens of cars,मैंने एक पूरा संग्रहालय किराए पर लिया दर्जनों कारों,I rented an entire museum have dozens वहाँ
The goods come from outside India,माल भारत के बाहर से आता है,The goods come from outside एक्सकोलिंग था
The only stipulation is if you skip a number,यदि आप कोई संख्या छोड़ देते हैं तो केवल एसटीसी जानकारी ही है,The only stipulation is if you skip a दान
to call and inform the coast guard,तट के गार्डों को बुलाने और सूचित करने के लिए,to call and inform the के- मैंद
whose name starts with L,जिसका नाम L से शुरू होता है,whose name गरीब स्वास्थ्य के लिए
Then I thought what do I have to do?,तो मैंने सोचा कि मुझे क्या करना है?,Then I thought what do I वास्तविक स्थिति
But anyhow lets get back to the incident,लेकिन किसी भी तरह से इस घटना को वापस मिलता है,But anyhow lets get back प्रचार का काम?
And they decided on another spot 4 miles from the predetermined landing spot,"और उन्होंने एक और जगह पर तय किया, जो पहले से उतरने के स्थान से 4 किलोमीटर दूर थी",And they decided on another spot 4 miles from the predetermined landing रात्रि
Therere many things about Hinduism infact every religion,हिंदू धर्म के बारे में अनेक बातें हर धर्म में निरर्थक हैं,Therere many things about Hinduism infact छेद के माध्यम से देखें
And the fictional tales of PN Oak,और पीएन ओक की कथा कहानियाँ,And the fictional tales of केस दिखाएँ
The jacket you are wearing now maybe you bought this fabric from a Japanese supplier,आप अब संभवतः एक जापानी आपूर्ति से इस कपड़ा खरीदा जा रहा है,The jacket you are wearing now maybe you bought this fabric from मसूड़ों के लड़के
It is so yellowish that once a professor,यह इतना पीला है कि एक बार एक प्रोफेसर,It is so yellowish that once a था
So both the brothers and their wives,तो (ऐ रसूल) भाइयों और अपनी बीवियों के साथ,So both the brothers and their हवाई सफर किया जाना है
I dont understand what proof do they need further?,मुझे समझ में नहीं आता कि उन्हें और क्या सबूत चाहिए?,I dont understand what proof do they ऐसा किया
Private companies are not only profiting from selling weapons,निजी कंपनियों के हथियारों को बेचने से केवल लाभ नहीं हैं,Private companies are not only profiting वातावरण
What did Cooper look like?,Cooper ने कैसा महसूस किया?,What did रंग
He became the founder of the new Afghan empire,वह नए Afran साम्राज्य का संस्थापक बन गया,He became the founder of the new Afghan विविध मूल वस्तुएँ
Most of the time its in my YouTube channel itself,मेरे यूट्यूब चैनल में अपना ज़्यादातर समय,Most of the time its in my YouTube आधिकारिक उत्तर
40 of the Indian Armys ammunition,भारतीय सेनाओं में से 40,40 of the इस पानी
So we are getting some things at a lower price,तो हम एक कम कीमत पर कुछ चीजें मिल रही हैं,So we are getting some things at पूल
they found that it is a very rare mineral on Earth,उन्होंने पाया कि यह पृथ्वी पर एक बहुत ही दुर्लभ खनिज है,they found that it is a very rare mineral on एक और
strategy remains the same the tip remains the same agar aap alag nahi kar sakte passion,रणनीति एक ही युक्ति बनी रहती है एक ही agagagagagagy जुनून,strategy remains the same the tip remains the same agar aap alag nahi kar sakte रास्ते
This was mentioned not only in this tweet,इसका उल्लेख इस टवैट में न केवल नहीं किया गया था,This was mentioned not only in this कि 1503 में
I think that will be the future,मुझे लगता है कि भविष्य होगा,I think that will be the हाथ
Honestly this phone is incredibly solid,ईमानदारी से यह फोन बहुत ही ठोस है,Honestly this phone विडमो निगाम एसJPL
edited nope really that really happened,संपादित नहीं करें,edited nope really that really स्वयं पर नियंत्रण का
is known as the worlds first skyscraper,विश्‍व के पहले आकाशीय आकाशीय भाग के रूप में जाना जाता है,is known as the एआईविजेंटर
Tomorrow Ill be doing what I was supposed to do 2 days ago,कल मैं क्या करना चाहिए था करने के लिए 2 दिन पहले,Tomorrow Ill be doing what I was supposed to do 2 कुछ मीटर
but perhaps a bigger problem was,लेकिन शायद एक बड़ी समस्या थी,but perhaps a bigger problem Cooper कि
And if you escaped it too,और अगर आप भी इससे बच गए,And if you escaped it रसूलों के लिए
If you look at any part of the painting,आप पेंटिंग के किसी भी हिस्से को देखें,If you look at any part अन्य देशों
Where they say that we are offering a free session,वे कहाँ कहते हैं कि हम एक मुक्त सत्र प्रस्तुत कर रहे हैं,Where they say that we are offering a free दस लाख
He remained at the station  dedicated to assisting those in need,वह ज़रूरतमंदों की मदद करने के लिए समर्पित था,He remained at the station dedicated to assisting those in इस चैनल पर
she encourages him to kll the other woman,वह उसे दूसरी औरत को चलाने के लिए प्रोत्साहित करती है,she encourages him to kll आपकी कैमरा अब
many such researches show that,ऐसे अनेक शोध दिखाते हैं कि,many such researches show उसका हाथ कल्पना
even after studying hard you know that you cannot get to the top ranks,कड़ी मेहनत के बाद भी आप जानते हैं कि आप ऊपरी वर्गों में प्रवेश नहीं कर सकते,even after studying hard you know that you cannot get to the top अन्य शुक्र ग्रह
Friends these are only myths,मित्र ये केवल काल्पनिक हैं,Friends these are only 10 रुपये जोड़ें
the rate of su!cide among men,मनुष्यों के बीच में मार - पीट की दर,the rate of ताज महल
The era when the dinosaurs had started emerging,जब खाना देने वाले पौधे उभरने लगे तब यह दौर,The era when the dinosaurs had हे भगवान
to keep the country protected,देश को सुरक्षित रखने के लिए,to keep the मेलबाक्स फिर से नहीं
Theyre a fabric layer here,यहां एक कपड़ा परत,Theyre a fabric आज के भोजन?
So it was a deep conversation actually,तो यह वास्तव में एक गहरी बातचीत थी,So it was a deep conversation नाम?
how will this happen right now this is,यह कैसे होगा अब यह है,how will this happen right पुराना शायद
effort more and expectation little so,और थोड़ा-सा देकर आशा,effort more and आप के अलावा
Additionally they even claim that,साथ ही वे यह दावा भी करते हैं,Additionally they even अंदर से दबाव
the incident were either about his,घटना उसके बारे में भी थी,the incident were शिकारी सात आधार
elections will also be held,चुनाव भी आयोजित किए जाएँगे,elections will also बाहर दुनिया
You can deposit as much as you want in those banks,आप उन बैंकों में चाहते हैं के रूप में के रूप में जमा कर सकते हैं,You can deposit as much as you want in पर
India is at number one,भारत एक नंबर पर है,India is क्रैश साइट
The amount of harmful radioactive material released in this disaster,इस विपत्ति में हानिकर रेडियो सामग्री की मात्रा,The amount of harmful radioactive material released 2023 में इस्तेमाल किया जा रहा है
because hes preparing for the hospital,क्योंकि वह अस्पताल के लिए तैयारी कर रहा है,because hes preparing for रोमन विरूरी
Today is the last day of the Summit,आज सम्मेलन का आखिरी दिन है,Today is the last day किसी ने कहा कि
Hey whats up?  Karl is it them?,कार्ल क्या कर रहा है?,Hey whats up? Karl कि
I mean it will be fun to see if,मेरा मतलब यह देखने में मज़ा आएगा कि क्या,I mean it will be fun to 10 घंटे से
So how did one of the worlds poorest countries,तो भला उन तमाम शहरों में से एक ने भी ऐसा ही किया,So how did one of the शांत हो जाओ!
Today we are going to talk about,आज हम इस बारे में बात करने जा रहे हैं,Today we are going to और गंभीर
Lal Bahadur Shastri used to say,Laldddrer शाथरी कहने के लिए इस्तेमाल किया जाता था,Lal Bahadur Shastri used 12?
Studying there wouldve been very expensive,वहाँ अध्ययन करना बहुत महँगा होता,Studying there wouldve उदाहरण के लिए
they are put in jail without being convicted,वे दोषी होने के बिना जेल में डाल दिए जाते हैं,they are put in jail वह जिमी चाहता है
If someone is looking at a SUPERSAF philosophy then he too has a big scream from me,अगर कोई एक मूर्ख तत्त्वज्ञान को देख रहा है तो वह भी मुझ से एक बड़ी चीख है,If someone is looking at a SUPERSAF philosophy then he too has a big पहाड़ी इलाके
and welcome to my favorite smartphone of 2024,और 2024 के मेरे पसंदीदा स्मार्टफोन के लिए आपका स्वागत है,and welcome to my favorite smartphone of अन्य
What you doing if Tucker pulls that?,तुम क्या कर रही हो अगर Trerers कि?,What you doing if Tucker pulls संदेश नियंत्रण
Google Cardboard to Apple VR,एपल वीआर में गूगल कार्ड- बोर्ड,Google Cardboard to दैनिक आधार
This content is authored by a 3rd party,यह सामग्री 3रा पार्टी द्वारा प्राधिकृत है,This content is authored by कि
And they declared war for Imperialism,और उन्होंने भयंकरवाद के लिए युद्ध घोषित किया,And they declared गूगल फेसबुक
And for this reason on 31st January 2024,"और इस कारण 31 जनवरी, 24 को",And for this reason on 31st January 50 दल के सदस्य
but I knew that I have responsibilities,लेकिन मैं जानता था कि मैं जिम्मेदारी है,but I knew that I वास्तविक अच्छा
Me and the boys at 300 AM,मैं और 300 अंक में लड़कों,Me and the boys at दिन
what is it about im always on my,क्या यह हमेशा मेरे पर अक्षम है,what is it about im always अवकाश
though at the mall it made everybodys,हालांकि हॉल में यह सभी लोगों को बनाया,though at the mall टेक?
Hitting 200 million with the boys was fun,लड़कों के साथ २०० लाख हिट मज़ा था,Hitting 200 million with the वे के बाद योजना बना रखें
