English,Hindi,Hinglish
Multiple Sonar sensors are strategically  installed around submarines,बहुत से सोनार सेंसरों के चारों ओर रणनीति रूप से संस्थापित हैं,Multiple Sonar sensors are strategically के चारों ओर संस्थापित किया गया
Best and worst oneone each,सबसे अच्छा और सबसे खराब एक,Best and worst oneone प्रत्येक
Were detonating the biggest explosion in YouTube history,यूट्यूब इतिहास में सबसे बड़ा विस्फोट किया जा रहा था,Were detonating the biggest explosion in YouTube यूट्यूब इतिहास में
is a quarter million dollar Lamborghini,एक चौथाई लाख डॉलर लाउंघाई है,is a quarter million dollar दस लाख डॉलर लांयेName
smartphones so usually the inflation number that the government shares with us which,स्मार्टफोन इतने आमतौर पर सरकार हमारे साथ साझा करती है कि,smartphones so usually the inflation number that the government shares with हमारे साथ
And honestly Ive done everything I can,और ईमानदारी से मैं कर सकते हैं सब कुछ किया है,And honestly Ive done everything आदमी आप मिले?
Oh thats way too much gas,ओह जिस तरह से ज्यादा गैस,Oh thats way कि पीछे
Come your shadows are calling you,आओ अपने छाया आप बुला रहे हैं,Come your shadows are भावनाएँ
she didnt need to read the instructions,उसे निर्देश पढ़ने की ज़रूरत नहीं थी,she didnt need to यहाँ चार्ज हो रही है
and tell me what you think,और तुम क्या सोचते हो मुझे बताओ,and tell me शहीद
In an effort to quash opposition to the French Revolution,फ्रांसीसी क्रांति का विरोध करने के प्रयास में,In an effort to quash opposition to the अब यह किया
always are okay here we go,हमेशा यहाँ हम चले,always are okay कि ताबूत
Nothing will happen in the end,अंत में कुछ भी नहीं होगा,Nothing will happen in the बायाँ
Main kehta hoon mere ko bhi hai,मुख्य हैंगा होन केवल कोरे भाई,Main kehta hoon mere को
Coming back to the topic of the Taj Mahal,ताज महल के विषय पर वापस आ रहा है,Coming back to the topic of the Taj वीडियो आज
Karl I dont care what he looks like,कार्ल मैं उसे पसंद क्या लगता है परवाह नहीं है,Karl I dont care what he इस विपत्ति का
can be a contributing factor  in someone becoming a criminal,एक अपराधी बनने के लिए किसी को दान देना ज़रूरी हो सकता है,can be a contributing factor in someone इस के लिए माता-पिता
Wait wait dont hold this That your sht thumbnail,इंतजार यह है कि अपने shht लघुछवि पकड़ नहीं है इंतजार करें,Wait wait dont hold this That your sht टोक्यो के पास
Your vitamin B12 is not good enough your iron is not good enough and gives you three,आपका विटामिन B12 काफी अच्छा नहीं है अपने लोहे काफी अच्छा नहीं है और आप तीन देता है,Your vitamin B12 is not good enough your iron is not good enough and gives you सुरक्षा की परत
Blake did the same thing at two other industrial stores,टेके ने भी दो अन्य औद्योगिक दुकानों में वही बात की,Blake did the same thing at two other industrial वह गायब हो जाएगा
They have horror audiobooks such as Bargad ka Ped,वे आतंकित ऑडियोबुक्‌स हैं जैसे कि बारगाद पेद,They have horror audiobooks such as Bargad मिशन नियंत्रण
None of yall talked me out of it,उनमें से कोई भी मुझे इसके बारे में बाहर बात की,None of yall talked me out सफेद शुद्ध चीनी
But had the same two people met each other in a restaurant in one of their countries,लेकिन एक ही देश में दो लोग एक दूसरे से मिले थे,But had the same two people met each other in a restaurant in one of फोन
Is this a locker room?,यह एक लॉकर कमरा है?,Is this साल पहले
Its a matter of health too,इसके स्वास्थ्य की भी बात,Its a matter of health इसे खरीदने के लिए
no so this is why when we speak to,इसलिए जब हम बात करते हैं तो ऐसा नहीं होता,no so this is why when we टीम?
I mean hes probably doesnt wanna go too fast,मेरा मतलब है कि वह शायद भी तेजी से जाना चाहता है,I mean hes probably doesnt wanna छेद लेकिन
I cant get up the hill!,मैं पहाड़ी ऊपर नहीं जा सकते!,I cant get up घंटे उह देर
Ache din aane waale hai,चेक भोजन एक पागल भाई,Ache din aane waale आपके लिए सुझाव
Is it their pattern to do all this? No!,क्या यह सब करना उनका आदर्श है?,Is it their pattern to do all एक समुदाय की तरह
If it wasnt executed perfectly,यदि यह पूर्ण रूप से चलाया गया होता,If it wasnt executed सायीName
You have no talent compared to her,आप उसकी तुलना में कोई तोड़ा की तुलना नहीं है,You have no talent compared और
But later that night we managed to get some footage,लेकिन बाद में उस रात हम कुछ फुट की दूरी तक पहुँचने में कामयाब हुए,But later that night we managed to दिन
These issues should prompt the media to  raise their voices and provide critical coverage,इन मुद्दों को मीडिया को प्रेरित करना चाहिए ताकि उनकी आवाज़ बढ़ा सकें और गंभीर चर्चा प्रदान कर सकें,These issues should prompt the media to raise their voices and provide critical मित्र
yes no have you ever um visited spain too have you ever visited spain at all no i havent oh,"हाँ, आप कभी भी उमप का दौरा किया है कभी भी आप कभी इनप अप अप अप अप किया है कोई भी ओह में",yes no have you ever um visited spain too have you ever visited spain at all no i havent कैमरा का
This offer is available only for the first 400 people among you,यह प्रस्ताव केवल आप में से पहले 400 लोगों के लिए उपलब्ध है,This offer is available only for the first 400 57 पर
About the origin of Kohinoor,कोनोसर के उद्‌गम के बारे में,About the origin चुनावों को खो दिया
Sometimes by placing GPS trackers on vehicles,कभी - कभी वाहनों पर जीपीएस ट्रैकों को रखने के द्वारा,Sometimes by placing GPS trackers सहेजा गया
but to continue fighting it,लेकिन इसे जारी रखने के लिए,but to विवरण में अविश्‍वासी
with a lens zoomed in on us,हम पर लेंस से ज़ूमेड के साथ,with a lens zoomed एक्सप्रेशन
So AI is the framework,इसलिए एआई फ्रेमवर्क है,So AI is का
and we wont have to apply demerits for the non compliance of SOP,और रोज़मर्रा की मालूली चीज़ें भी आरियत नहीं देते,and we wont have to apply demerits for the non compliance इस एक को खोलें
try and force fit modern discoveries and try and find parallels that are there in the scriptures,आज की खोज में कामयाब होने की कोशिश कीजिए और देखिए कि शास्त्र में क्या - क्या खोज की गयी है,try and force fit modern discoveries and try and find parallels that are there in the सीट
I got a pair of mismatched vans,मैं बेमेल वान्स की एक जोड़ी मिला,I got a pair of mismatched इस वीडियो को पसंद आया
all my invisible assistants here have,मेरे सभी अदृश्य सहायक यहाँ है,all my invisible assistants here वीडियो
A box of peanuts some dates candies dried plums,मूँगफली का एक बक्सा,A box of peanuts some dates उच्चतम
Since I doubled Wills money and TNT,चूँकि मैं दुगना पैसा और टीएनटी देता हूँ,Since I doubled Wills money अभी तक नहीं किया
and they would have the exclusive rights to this facility,और उनके पास तो वह हालात पहुँच चुके हैं जिनमें काफी तम्बीह थीं,and they would have the exclusive rights to मरीज़ों
I always say that behind the patient,मैं हमेशा कहते हैं कि मरीज़ के पीछे,I always say that या 15000
came to know about this one hour later at 520 PM,520 के बाद इस एक घंटे के बारे में पता चला,came to know about this one hour later at 520 सुंदर बात
This was the worst division of ICCs associate members,यह आईसीसी सदस्यों का सबसे बुरा विभाजन था,This was the worst division of ICCs परमेश्‍वर जो उपवास करता है
Apparently the Pakistani forces tried to negotiate with the hijackers,जाहिर है पाकिस्तानी सेनाओं ने अपहरण करनेवालों के साथ बातचीत करने की कोशिश की,Apparently the Pakistani forces tried to negotiate with the महल
I used to do that,मैं ऐसा करने के लिए इस्तेमाल किया,I used पावर
if were talking pixel then were,यदि टाइप कर रहे होते तो पिक्सेल में,if were talking pixel छुट्टियों
difficult for people who do not know,जो लोग (ख़ुदा की राह में) नहीं जानते उनके लिए बहुत कठिन है,difficult for people who do यह
Im good claps  Im going,एमआईएमआईआईएम जा रहा है,Im good claps Im मैं कर सकते हैं
Here its also about team building,यहाँ भी टीम इमारत के बारे में,Here its also about गैस
In China many people are doing 8090,चीन में कई लोग 8090 कर रहे हैं,In China many people are आप
and Almost Pyaar with DJ Mohabbat,और लगभग ट्यायार के साथ DJJYBbababa. kgm,and Almost Pyaar with DJ निर्देश पढ़ें
It will get you all the eyeballs,यह सभी आंख आप मिल जाएगा,It will get you all आप सोचते हैं
Sorry Im not trying to die,माफ करना मैं मरने की कोशिश नहीं कर रहा हूँ,Sorry Im not trying to फ्रांसीसी क्रांति
Its speed is around 250 kmhr,इसकी गति 250 किलोमीटर से करीब है,Its speed is around 250 जाओ
evident to us 6 months ago when a woman,हम 6 महीने पहले ज़ाहिर करते हैं कि एक औरत ने क्या किया था,evident to us 6 months ago when a अंत
Friends the answer to this is mostly no,मित्र इस का जवाब ज़्यादातर नहीं है,Friends the answer to this मूढी भाई
key slamming You have 10 seconds to decide,कुंजी अनदेखा करना आपके पास 10 सेकंड हैं तय करने के लिए,key slamming You have 10 seconds ताज महल
A legacy what does it do?,यह क्या करता है?,A legacy what does it जैसे
The living costs are quite expensive,जीने का खर्च बहुत महँगा होता है,The living costs are अपराधी बनना
so they can continue to help build,ताकि वे निर्माण काम जारी रख सकें,so they can continue लघु छवि
But let me throw one more question out,लेकिन मैं एक और सवाल बाहर फेंक दें,But let me throw one more question तीन
This could happen because comets and asteroids,यह हो सकता है क्योंकि धूमकेतुओं तथा क्षुद्र ग्रहों,This could happen because comets अन्य औद्योगिक भंडार
Karl was right above us,कार्ल सही हमारे ऊपर था,Karl was काददद
However no one considered these appeals seriously for so long,लेकिन कोई भी इन आकर्षणों को इतने लंबे समय तक गंभीरता से नहीं समझा,However no one considered these appeals seriously इससे बाहर
station to meet the youtuber,आप कोखने के लिए स्टेशन,station to meet the अपने देशों का
I keep forgetting this is about you,मैं भूल रखना यह आप के बारे में है,I keep forgetting this is about कमरा?
The same captain who tried to cover it up with lies,उसी कप्तान ने उसे झूठ से छिपाने की कोशिश की,The same captain who tried to cover it up स्वास्थ्य का भी
my father tells me this every time,मेरे पिता मुझे यह हर बार बताता है,my father tells me हम से बात की
When the reward you get after completing the task,"और जब किसी काम के करने का तुम्हें बदला दिया जाता है,",When the reward you get after completing बहुत तेज
located at a high point,एक उच्च स्थान पर स्थित,located at a पहाड़ी!
Recently when farmers had to go back to the streets to protest again,हाल ही में जब किसानों को फिर से विरोध करने के लिए सड़कों पर लौटना पड़ा,Recently when farmers had to go back to the streets to वेते भाई
He sent it you cause you liked it,उन्होंने कहा कि आप इसे पसंद करते हैं,He sent it you cause you यह सब नहीं!
also to handle customer care people they,ग्राहक परवाह लोगों को संभालने के लिए भी,also to handle customer पूर्ण रूप से चलाया गया
indeed had torpedoes at both ends,दोनों सिरों पर ही चलाना होता है,indeed had torpedoes उसे
and he promised that there would be no corruption and no nepotism,उसने वादा किया था कि उसमें न तो कोई खराबी होगी और न गुनाह की बात,and he promised that there would be no corruption कुछ फुटेज मिलता है
He emphasized that in addition to cutting down trees and mountains,उसने ज़ोर दिया कि पेड़ - पौधों और पहाड़ों को काटने के अलावा,He emphasized that in addition to cutting down गंभीर चर्चा प्रदान करें
Were like 200 feet away and its nighttime,200 फुट दूर और रात की तरह थे,Were like 200 feet away ओह
If you have decided to do something,अगर आपने कुछ करने का फैसला किया है,If you have decided आप
That means your food choices,इसका मतलब है कि आपके खाने के चुनाव,That means your food कोनोयर का उद्‌गम
his NGO found out how Adani,उसकी NGO को पता चला कि कैसे Aago,his NGO found वाहनों पर
It is strong enough to sustain the weight of 2 African elephants on top of it,इसके शीर्ष पर 2 अफ्रीकी हाथियों का वज़न घटाने के लिए काफी मज़बूत है,It is strong enough to sustain the weight of 2 African elephants on top of इसे जारी रखें
recruit hundreds of thousands of Indians,हज़ारों आदिवासियों को भर्ती करना,recruit hundreds of thousands of हम पर
I still would rather eat a vanilla Oreo,मैं अभी भी एक पौधे ओरेओ खाने के बजाय खाना होगा,I still would rather eat a vanilla फ्रेमवर्क
bro come on all right you know what yeah,भाई सब सही पर आते हैं तुम्हें पता है क्या हाँ,bro come on all right you know एसओपी का पालन
The more love and brotherhood will develop among people,लोगों में ज़्यादा प्यार और भाईचारे की भावना होगी,The more love and brotherhood will develop और उसकी किताबों में
At the same time he had some critics too,"साथ ही, उसके कुछ आलोचक भी थे",At the same time he had बेमेल वान्स का
Lets try to work on all this negative energy,आइए इन सभी चीज़ों पर काम करने की कोशिश करें,Lets try to work on all है
The incident unfolded in Uttarkashi district in Uttarakhand,ऊतकाशी ज़िले में हुई घटना,The incident unfolded in Uttarkashi district लाल हरा रंग
that is this year in FY 2024,कि इस साल FY 2024 में है,that is this year in पैसा और टीटी
on top of the world literally and figuratively,"दुनिया के सबसे ऊपर, लाक्षणिक तौर पर और लाक्षणिक तौर पर",on top of the world literally इस सुविधा के लिए
A puppet government was placed,एक काल्पनिक सरकार बनायी गयी,A puppet government धैर्य से काम लो
This is a big hole on the moons surface,यह चाँद की सतह पर एक बड़ा छेद है,This is a big hole on the 520 में अपराह्न
I dont know how we got from Mac computers to watermelon,मुझे नहीं पता कि कैसे हम Mac कंप्यूटर से पानीोन तक मिला,I dont know how we got from Mac computers सदस्य
words in my mind to myself okay these,मेरे मन में ये शब्द ठीक हैं,words in my mind to myself okay अपहरण करनेवालों के साथ
But since they paused it the birds fine,"और पक्षियों को भी, जो एकत्र हो जाते थे। प्रत्येक उसके आगे रुजू रहता",But since they paused it the birds ऐसा करें
when Im not utterly fried and completely insane,और जिस वक्त रुहें हवियों से मिला दी जाएंगी,when Im not utterly fried and तब थे
Well see you in the morning,अच्छी तरह से सुबह में आप देखते हैं,Well see you in पता
This is the man you met?,यह आप मिले थे आदमी है?,This is the man you इस खेल का अब
We have we have to run that back,हमें लगता है कि वापस चलाने के लिए है,We have we have to run that हवा
Its said that history is based on facts and not on emotions,इस किताब में कहा गया है कि इतिहास भावनाओं पर नहीं बल्कि तथ्यों पर आधारित है,Its said that history is based on facts and not खुद का
You will see that this phone  is getting charged here,आप यह फोन यहाँ आरोप लगाया जा रहा है कि देखेंगे,You will see that this phone is getting चोट लगी
and compensations for families of martyrs,फिर (उनको) फाड़ कर जुदा कर देती हैं,and compensations for मनोवैज्ञानिक मुद्दों को विकसित करना
As we see now it did,हम अब इसे देखा है के रूप में,As we see साल
Youre going to hit 200 million subscribers in that coffin,कि तांग में 200 लाख चोरों को मारने जा रहे हैं,Youre going to hit 200 million subscribers अदालत में प्रतिनिधि
And dont forget you literally only have two hours left,और तुम शाब्दिक रूप में केवल दो घंटे बचे हैं भूल जाओ,And dont forget you literally only have two मित्र
and the final world record we try to,और अंतिम विश्‍व अभिलेख हम करने की कोशिश करते हैं,and the final world record फ़िल्म
The things that I am going to  show you in this video today,मैं आज इस वीडियो में तुम्हें दिखाने के लिए जा रहा हूँ जो बातें,The things that I am going to show you in this पेन्स?
As a direct result of this disaster,इस विपत्ति का सीधा परिणाम,As a direct result सुनिश्चित करें
And thankfully there wasnt any pressure from my parents for this,और शुक्र है कि वहाँ मेरे माता - पिता से कोई दबाव नहीं था इस के लिए,And thankfully there wasnt any pressure from my parents for एक इंजीनियर वैज्ञानिक
The Japanese government will try to build a Next Tokyo near Tokyo,जापान की सरकार टोक्यो के पास अगला टोक्यो बनाने की कोशिश करेगी,The Japanese government will try to build a Next Tokyo इस मिशन
lies in providing an additional layer of protection,सुरक्षा का एक अतिरिक्‍त परत प्रदान करने में झूठ,lies in providing an additional खर्च करें
a new screen popped up it would disappear,एक नया स्क्रीन पॉप अप इसे गायब हो जाएगा,a new screen popped up it would फुटबॉल
after which they were given the permission from the mission control,इसके पश्चात उन्हें मिशन के मामले में अनुमति दी गई,after which they were given the permission from विश्‍वविद्यालय
