English,Hindi,Hinglish
I mean theres no comparison from any VR to Apple VR,मेरा मतलब है कि किसी भी वीआर से बाहर वीआर वीआर से तुलना नहीं है,I mean theres no comparison from any VR वीआर
And the negotiations went on so,और समझौता इतना पर चला गया,And the negotiations went on इस पर
Nolan you should ride the first one,आपको पहले एक पर सवारी करनी चाहिए,Nolan you should ride प्रथम
big screen great camera great for multitasking,बहुकार्य के लिए बड़ा स्क्रीन कैमरा बड़ा करें,big screen great camera बहुकार्य
All right guys Last one to fall off wins 2000,सभी ठीक लोग पिछले एक को जीतने के लिए 2000 से बंद करने के लिए,All right guys Last one to fall जीता 2000
At one time you were not as big You were not as big,एक बार तुम बड़े नहीं थे... ... आप बड़े नहीं थे,At one time you were not as big You were not बड़ा
but look at it carefully,पर ध्यान से देखो,but look at इसे ध्यान से
That though the films pretends to be a feminist romp,यह सच है कि फिल्मों में भूत - प्रेतों को बढ़ावा दिया जाता है,That though the films pretends to be a एक ढोंगी
the heck oh wow get in get it oh,Heck ओह में मिलता है यह ओह में मिलता है,the heck oh wow get in get यह ओह मिलता है
They didnt expect the German army to invade via this forest,वे उम्मीद नहीं थी कि जर्मन सेना इस जंगल के माध्यम से हमला करने के लिए,They didnt expect the German army to invade via इस जंगल के माध्यम से
got to work to completely,पूरी तरह से काम करने के लिए किया गया है,got to पूरी तरह
You guys have been spamming my comment section,तुम लोग मेरा टिप्पणी खंड स्पैम कर रहे हैं,You guys have been spamming my खंड
then the government should pay more,तब सरकार को अधिक भुगतान करना चाहिए,then the government should अधिक भुगतान करें
Blake began adding a lot more objects,स्क्रैच एक बहुत सारी वस्तुएँ जोड़ना शुरू कर दिया,Blake began adding a अधिक वस्तुएँ
Oh that was just me  I went to Ohio,ओह कि सिर्फ मैं ओहायो गया था,Oh that was just me I ओहायो
Just get a shovel ready all right?,बस एक भेड़ों को सब ठीक तैयार करने के लिए मिलता है?,Just get a shovel सही?
Pihu was saying that Mom had moved the seat very far forward,पीवान कह रहा था कि माँ ने सीट बहुत आगे बढ़ा दी थी,Pihu was saying that Mom had moved the seat very far आगे
Because Im so engrossed in the office,क्योंकि मैं कार्यालय में इतनी भरी हुई हूँ,Because Im so engrossed कार्यालय
that support these healthy behaviours,जो इन स्वस्थ व्यवहारों का समर्थन करते हैं,that support these स्वस्थ व्यवहार
by dropping a Mac Mini onto a Mac from five feet,Mac मिनी को पाँच फुट से एक मैज पर छोड़ने के द्वारा,by dropping a Mac Mini onto a Mac पांच फीट से
He told me about all that,उन्होंने कहा कि सभी के बारे में मुझे बताया,He told me कि
the ate slept and took pictures of themselves and their surroundings,"सो खाने के बाद, वे अपने और अपने आस - पास के लोगों की तसवीरें ले गए",the ate slept and took pictures of themselves and their और अपने घरों की ओर
This place is going to blow your mind and to make this house tour,यह जगह आपके मन को उड़ा रही है और इस घर का दौरा करने के लिए जा रहा है,This place is going to blow your mind and to make this इस घर का दौरा
and at the organizational level,और संगठनात्मक स्तर पर,and at the संगठनात्मक स्तर
They were about to announce a movement,वे एक आंदोलन की घोषणा करने वाले थे,They were about to announce a गति घोषणा
Sadhguru So with this the yields have gone up significantly,Suuuuuuuuuuuuuuuuu इस सफलता के साथ उल्लेखनीय रूप से चला गया है,Sadhguru So with this the yields have महत्वपूर्ण
Since the geography of this area is such,क्योंकि इस क्षेत्र का भूगोल ऐसा है,Since the geography of this area is ऐसा है
rub your back on the back of the chair,कुर्सी की पीठ पर अपनी पीठ लाल रंग,rub your back on the back of कुर्सी
Later countries like the USA and Japan,बाद में अमरीकी और जापान जैसे देशों,Later countries like the जापान
lets all other this girl kini is safe,सभी अन्य इस लड़की रिश्ता सुरक्षित है,lets all other this girl kini is रिश्ता सुरक्षित है
he was back in power,वह वापस शक्ति में था,he was back वापस शक्ति में
So what will be Should I answer?,तो मुझे क्या जवाब देना चाहिए?,So what will be Should I जवाब?
I didnt even know you could put billboards in the ocean,मैं भी आप समुद्र में बिलबोर्ड डाल सकता है पता नहीं था,I didnt even know you could put billboards in सागर
Oh I can literally see through it from back here,ओह मैं इसे वापस से यहाँ के माध्यम से देख सकते हैं,Oh I can literally see through it from यहाँ वापस
contestants yelling  No no no no!,प्रतियोगिता करनेवालों ने चिल्ला चिल्लाकर नहीं कहा!,contestants yelling No no no नहीं!
So basics is that you should always be with the trend,तो बुनियादी बातें यह है कि हमेशा आप को इस चलन के साथ होना चाहिए,So basics is that you should always be इस चलन के साथ
Napoleon who lost the territories  and abandoned his army,नेपोलियन जिन्होंने क्षेत्रों को खो दिया और अपनी सेना को छोड़ दिया,Napoleon who lost the territories and abandoned सेना
Call him We will do it together,"हम उसे सहज ढंग से उस चीज़ का पात्र बना देंगे, जो कठिन चीज़ (कष्ट-साध्य) है",Call him We will do it एक साथ
First the tanker was moving towards them so fast,पहले टैंकर उन पर इतनी तेज़ी से चल रहा था,First the tanker was moving towards them so तेज
And in the latest budget for 2024,और 2024 के लिए नवीनतम बजट में,And in the latest budget for 2024
How much someone here believes in god,यहाँ कोई भगवान में विश्वास करता है कितना,How much someone here देवता
the Great Leap Forward Campaign,ग्रेट लेप आगे बढ़ते क्रम में,the Great संवाद
25 billion at that time,उस समय 25 अरब,25 billion at उस समय
Would there ever be an aircraft,एक विमान कभी होता,Would there ever be एक विमान हो
This safe is now surrounded by 100000 in explosives?,यह सुरक्षित अब विस्फोटकों में 100000000 से घिरा हुआ है?,This safe is now surrounded by 100000 विस्फोटक?
was getting more nervous but we also noticed that all,और भी परेशान हो रही थी लेकिन हमने यह भी देखा कि सभी को,was getting more nervous but we also noticed that कि सभी
Your crate on the bottom is bowing,नीचे की ओर आपका रंग घुटने टेक रहा है,Your crate on the bottom सजदे करते है
the apple of the Great Eye But the winged Nazgl not yet not yet He wont let them,जो (ख़ुदा के इल्म में) फेरा जा चुका है अटकल दौड़ाने वाले हलाक हों,the apple of the Great Eye But the winged Nazgl not yet not yet He wont let जो उन्हें दिया गया था
Because his family members invest their time to help him,क्योंकि उसके परिवार के सदस्य उसकी मदद करने के लिए अपना समय लगाते हैं,Because his family members invest their time to help उसकी मदद करो
after installing this you will be asked to verify your mobile no which is linked to your google account,इसके स्थापित होने के बाद आपको अपने मोबाइल खाता को सत्यापित करने के लिए कहा जाएगा जो कि आपके जाने वाले खाते से जुड़ा हुआ नहीं है,after installing this you will be asked to verify your mobile no which is linked to your google अपने चलते खाता
about to jump out they were in an,वे एक में थे बाहर कूद करने के लिए बारे में,about to jump out they were in एक
I would like to show you a report from this year,मैं तुम्हें इस साल से एक रिपोर्ट दिखाना चाहता हूँ,I would like to show you a report from इस साल
Means I will say this if he said today at 12,मतलब मैं इसे कहना होगा अगर वह आज 12 पर कहा होगा,Means I will say this if he said 12
Wait a minute Jimmy where hes standing at,एक मिनट जिमी रुको जहाँ वह खड़े है,Wait a minute Jimmy where hes standing खड़े होने पर
when Francesco and Lisa bought their home,जब फ्रांस्सको और लिसा ने अपना घर खरीदा,when Francesco and Lisa bought उनके घर
app was downloaded just click on setup,एईवी डाउनलोड किया गया सिर्फ सेटअप पर क्लिक करें,app was downloaded just सेटअप पर
The iPad is a second display and also,आईपीड एक दूसरे प्रदर्शन तथा साथ भी है,The iPad is a second display and प्रदर्शन और भी
Because there isnt one it leads to an explosion,क्योंकि वहाँ एक यह एक विस्फोट की ओर ले जाता है,Because there isnt one it leads to an विस्फोट
Its really very sad but people realised that,यह वास्तव में बहुत दुःखद लेकिन लोगों को एहसास हुआ कि,Its really very sad but people लोगों को एहसास हुआ कि
But I dont wanna let you guys down,लेकिन मैं तुम्हें लोगों को नीचे जाने नहीं करना चाहता,But I dont wanna let you लोग नीचे
You didnt say I could not sword you,आप नहीं कहा कि मैं आप तलवार नहीं कर सकता,You didnt say I could not आप तलवार नहीं है
This suspense is killing me,इस टाइटैनिक मुझे मार रहा है,This suspense is मुझे मार डालो
i dont have more to say about this tshirt if we talk about looks?,मैं हम दृष्टि के बारे में बात करने के बारे में इस टी के बारे में और अधिक कहना है?,i dont have more to say about this tshirt if we लग रहा है?
You guys have cracked the Instagram code,आप लोगों ने इनस्टाग्राम कोड दरारी है,You guys have cracked the इंस्टाग्राम कोड
You might think that this is a projection,आप शायद सोचें कि यह एक प्रवचन है,You might think that this प्रोजेक्शन (P)
Mohamed Nasheed and Ibrahim Mohamed Solih,मोरामद ने नाशेद और इब्राहीम मोम ने सोला,Mohamed Nasheed and इब्राहीम मोमित सोला
Sadhguru Hey I have no ideology,दुःख की बात है कि मेरे पास कोई तत्त्वज्ञान नहीं है,Sadhguru Hey I have no कोई तत्व नहीं है
These dont raise or lower the blood sugar level,इन्हें खून में शक्कर की मात्रा कम करने या कम करने के लिए इस्तेमाल किया जाता है,These dont raise or lower the blood रक्‍त चीनी स्तर
real assuming theyre real he just lost,असली वे महसूस कर रहे हैं असली वह सिर्फ खो दिया,real assuming theyre real he just खोया
And the other MLA who sold his soul for some money,अन्य एमएल जिसने कुछ पैसे के लिए अपना प्राण बेच दिया,And the other MLA who sold his soul for कुछ पैसे के लिए
I dont know Its kind of chunky,मैं इस तरह की रीकरी पता नहीं है,I dont know Its kind of फिर से कोशिशों की
Oh my God  Its hanging over the edge!,ओह मेरे भगवान इसे किनारे पर लटका!,Oh my God Its hanging over the किनारे!
Scale to Scale now we are getting but before if you,स्केल करने के लिए आकार अब हम हो रहा है लेकिन पहले अगर आप,Scale to Scale now we are getting but आप
A dark shape like a cloud and yet not a cloud for it moved far more swiftly,बादल की तरह अँधेरा आकार और फिर भी इसके लिए बादल नहीं होता था ।,A dark shape like a cloud and yet not a cloud for it moved तेजी से
have been following me in this recent,इस हाल में मेरा अनुसरण कर रहा है,have been following me इस हाल में
Speaker Gaurav Taneja I thought it is because of the volume it satisfies the hunger,अध्यक्ष Gaugajja मैंने सोचा था कि यह मात्रा के कारण है यह भूख संतुष्ट करता है,"Speaker Gaurav Taneja I thought it is because of the volume it satisfies भूख से जो कुछ भी प्राप्त होता है,"
banane ke liye wali exercise karlo are khaan acha khao exercise,प्रतिबंधदार लचीली व्यायाम एक साचा का अभ्यास कर रहे हैं,banane ke liye wali exercise karlo are khaan चिंचो व्यायाम
At least we dont have to shower,कम से कम हम स्नान करने के लिए नहीं है,At least we dont have बरसात करनी है
they built a solar grid,और उन्हों ने एक सौर ग्रिड बनाया,they built ग्रिड
It is wrong to show fake lifestyle in the name of content,संतोष के नाम पर नकली जीवन - शैली दिखाना गलत है,It is wrong to show fake lifestyle in the सामग्री
who was in a coma due to a skull fracture,जो एक खोपड़ी कोक के कारण कोमा में था,who was in a coma due to a skull खोपड़ी
Hold on to this exponential point,इस एक्सपोनेंशियल बिन्दु पर होल्ड करें,Hold on to this exponential इस एक्सपोनेंट बिन्दु
Slowmo shot walking outta the water,धीरेमो शॉट पानी से बाहर चल रहा है,Slowmo shot walking पानी
and it clearly states that if you do not do this then it amounts to non compliance of SOP,और कहते हैं कि अगर तुम लोग ऐसा न करते तो ये हरगिज़ नहीं करते,and it clearly states that if you do not do this then it amounts to non एसओपी का
Of which 26 were males,जिनमें 26 पुरूष थे।,Of which 26 were पुरुषों
Yes but we cant play Where is the antenna?,"हाँ, लेकिन हम नहीं खेल सकते एक एंटीना कहाँ है?",Yes but we cant play Where एक एंटीना?
I am not talking that the price of the same spec comes,मैं बात नहीं कर रहा हूँ कि एक ही तत्व की कीमत आता है,I am not talking that the price of the same स्पेसर आता है
Yeah that was my viking call,हाँ कि मेरे ब्लिंग कॉल किया गया था,Yeah that was my viking मेरी लिंग कॉल
and just to put that in perspective if,और बस यह ध्यान में रखना है कि अगर,and just to put that यदि संभव हो तो दृष्टिकोण में
You will get 5G connectivity,आप 5Gt कनेक्ट मिल जाएगा,You will get 5G 5Ganc. kgm
oh oh my God better have let him keep,ओह मेरे भगवान बेहतर उसे रखने दिया है,oh oh my God better have let him रखें
The depth of this trench is 84 km,इस गड्ढे की गहराई 84 किलोमीटर है,The depth of this trench 84 किलोमीटर
and I did write down the reason that the circulars were not being followed There were other points as well,और मैं ने कारण नीचे लिखा था कि वृत्तों का पालन नहीं किया जा रहा था और अन्य मुद्दे भी थे,and I did write down the reason that the circulars were not being followed There were other अंक तथा साथ ही
I bought the whole bundle,मैं पूरे बंडल खरीदा,I bought the पूरा बंडल
With that watermark you can always identify whether,उस जल मार्क के साथ आप हमेशा पहचान सकते हैं कि नहीं,With that watermark you can पता लगाएँ कि क्या
But sir our population is very big,लेकिन सर हमारी आबादी बहुत बड़ा है,But sir our population is very बहुत बड़ा
There he took refuge from Maharaja Ranjith Singh,वहाँ वह माहोहा रोजी सिंह से शरण ली,There he took refuge from रीजीत सिंह
Oh!  Oh there is a second one,ओह! ओह वहाँ एक दूसरे एक है!,Oh! Oh there is a second दूसरा
But no one could find him,लेकिन कोई भी उसे पा नहीं सकता था,But no one उसे मिल सकता था
mm Yeah!! The EPO injections,"ठीक है, ठीक है!",mm Yeah!! The EPO इंजेक्शन
gave up their arms because they didnt want to fight in the war,युद्ध में लड़ाई करना चाहते थे क्योंकि वे हार नहीं मानते थे,gave up their arms because they didnt want to fight in the युद्ध में
a true attack helicopter legend please,एक सही हमला की कथा कृपया,a true attack कृपया
It is basically said to be a medium to communicate with ghosts,कहा जाता है कि यह मूल रूप से भूतों से बातचीत करने के लिए माध्यम है,It is basically said to be a medium to communicate भूत के साथ
You can find the link to the course in the description below,नीचे विवरण में आप लिंक पा सकते हैं,You can find the link to the course in नीचे दिया गया विवरण
Weve closed both doors here,यहाँ दोनों दरवाजे बंद कर दिए हैं,Weve closed both यहाँ दरवाजे
Oh that was probably the worst drive ever,ओह कि शायद सबसे बुरा ड्राइव कभी था,Oh that was probably the worst कभी ड्राइव
which is risking the lives of the people sitting behind as well as his life,जो लोगों के जीवन और उसके जीवन के पीछे बैठे लोगों के जीवन को जोखिम में डाल रहा है,which is risking the lives of the people sitting behind as well as अपने जीवन के रूप में
There are I have seen and I have read about it,मैं वहाँ देखा है और मैं इसके बारे में पढ़ा है,There are I have seen and I have read यह
change their skin on average?,औसत पर अपनी त्वचा बदल?,change their औसत?
But now the thing is that lets say everyone has it,लेकिन अब बात यह है कि हर किसी को यह कहने देता है,But now the thing is that lets say everyone has हर कोई यह है
Companies by Yevgeny Prigozhin mined for gold,आमतौर पर सोने के लिए इस्तेमाल किया जाता है,Companies by Yevgeny Prigozhin mined for सोना
I hope she know So this is tricky!,मुझे आशा है कि वह इतना मुश्किल है!,I hope she know So this is मुश्किल है!
They wanted to communicate with the officials in Delhi,वे दिल्ली के अधिकारियों से बात करना चाहते थे,They wanted to communicate with the officials in दिल्ली में
A system where all power is held by men,एक तंत्र जहाँ मनुष्यों द्वारा बनाए जाते हैं,A system where all power is held by लोगों के पास
It was first put in Queen Alexandras crown,यह पहली रानी एलिग्ज़ैंड्रा के मुकुट में डाल दिया गया था,It was first put in Queen Alexandras एलिग्ज़ैंड्रा का ताज
You could offer me a billion dollars,तुम मुझे एक अरब डॉलर दे सकता है,You could offer me a डालर
where I ran away from a bounty hunter and the FBI,और मैं तो यक़ीनन (उसकी इबादत के लिए) सफ बाँधे खड़ा था,where I ran away from a bounty hunter and एफआईटीएस
give huge amounts of money to these TV  channels for running advertisements,विज्ञापन चलाने के लिए इन टीवी चैनलों को बहुत पैसा दीजिए,give huge amounts of money to these TV channels विज्ञापन
