Hindi,English
नहीं जाऊंगी मैं बता रही हूं पहले ही कम,I'm not going to tell you what's happening.
मुलाजिम है क्या उनके घर में जो उन्हे और,Is There a Creator Who Cares About Them and Their Homes?
जरूरत पड़ गई है और अगर कम पड़ रहे तो एक,We've got to need it and if you're low
दो और रख ले,Have two more
जवेरिया अम्मी व कर सकते हैं ना मैं इसलिए,Zariamami and I can do this so
कह रही हूं अरे भाई हर एक पर तो भरोसा,I'm saying it's everyone's trust.
नहीं किया जा सकता,cannot be performed
ना मंगनी वाला घर है लाखों का सामान है,"There's no engagement home, there's millions of stuff."
कपड़े हैं जेवर है अब मुलाजिमों भी तो,"Wears are frugals, so much so much"
भरोसा नहीं कर सकती ना अगर तुम चली जाओगी,Can't trust if you leave
घिस तो नहीं जाओगी कभी किसी के काम भी आ,"You won't wear out, no matter how useful"
जाते हैं आप ही है ना आप ही आएंगी काम,It's not you or you're working.
उनको बहुत शौक है वैसे भी उन्हें भेजे मैं,They love them anyway I send them
कोई मुलाजिम थोड़ी हूं किसी की यार अम्मी,I'm a little bit a man's friend.
खुद सोचे आप,Would you like to learn more about God?
जवेरिया अम्मी छोड़े उसे,Let Zariami leave her
आप यास्मीन अंटी को कॉल करके बोले कि आयशा,You called Yasmin Altie and said that she was pregnant
आ जाएगी और सारे काम कर देगी देखो आयशा यह,She shall go forth and work.
लड़की बहुत खुद सर होगी मजाल है जो कोई भी,The girl must be very proud of herself
मेरी बात मानती हो छोड़े ना अम्मी उसे अभी,"Listen to me, Mom, please leave her now"
छोटी है इतनी अकल नहीं उसे अरे बेटा तुमसे,"Little so good it's not so bad from you, son."
दो साल ही तो छोटी है तुमने मुझे आज तक,Two years is too short for me till this day.
तंग नहीं किया जितना यह लड़की मुझे तंग,Not as this girl closed me up
करती है मेरी कोई बात नहीं,It doesn't matter to me.
मानती ना चढ़ाए ब्लड प्रेशर हाई हो जाएगा,Shedding blood pressure will gain high
बिला बज नहीं तो बंदे को किसी के काम भी,It does not seem to be the work of anyone.
तो आना चाहिए ना यास्मीन की बेटी ही नहीं,So let's not have any daughter of Yasmin
है चलो जाकर उनकी हेल्प करा,Let's go and help them.
दे मुझे बता दीजिएगा मैं सारे काम उके कर,Tell me I can do everything
दू ठीक है अरे बेटा तुम तो चली ही जाओगी,"Okay, son, you'll just go away."
ना इसको भी तो एहसास करना चाहिए ना मैं,I shouldn't even realize it
जाके कपड़े चेंज करती आप राब,Zakae makes you change your clothes
प्रशंसा,Praise
कर,Do it.
आयशा वक्त कम है और बहुत सारे काम पड़े,She has less time and more work.
हुए हैं बेटा ये दुपट्टे देखे तुमने इनका,Sons! You saw them in the cover.
मुझे बताओ कि इनका क्या करना है समझ नहीं,Tell me what they don't understand to do
आ रही कि ये देखो ना ये वाला दुपट्टा इसकी,Behold! It is the covering thereof.
कढ़ाई कराऊ लेसेस लगाऊं क्या करूं जरा,What do you think I should do?
मशवरा दो मुझे आंटी अगर आप इस दुपट्टे की,"Keya, let me have aunty if you put this upper hand of yours."
बात करें,Talk
तो कॉपर की एंब्रॉयडरी और,Then anthropomory of the Copper and
गोल्डन कलर में इसकी पाइपिंग करवा लेते,Make it pipe to Golden Color
हैं और इसका,And it has...? . . . . . . . . . . . . . . . . . . . . . . . . . . . . . . . . . . . . . . . . . . . . . . . . . . . . . . . . . . . . . . . . . . . .
बताओ आप एक काम करें ना आप ड बट्टे मुझे,"Tell me you do a job, don't you pay me?"
दे दे मैं मैं यह मुकम्मल करके देती हूं,Give it to me.
आपको तुम खुद करोगी हा तो इसमें मुश्किल,"If you do it yourself, it's hard for you to do it."
वाला क्या काम मैं आपको आज ही मुकम्मल,What the hell's gonna do to you today?
करके दे दूंगी यह सब दुपट्टे में अलग कर,Let's draw it in the blanket.
देती हूं बहुत प्यारी बच्ची हो तुम जीती,I give you a very sweet girl you're alive
रहो अच्छा मुझे यह बताओगे एक तो पहले यह,I'm gonna tell you this one before you know it.
सेट देखो कैसा,Look how set
य बहुत खूबसूरत,Very beautiful
है पसंद आए तुम्हें बहुत प्यारे है बहुत,I love you very much.
मेहनत की है,The Work Is Hard
मैंने मुझे समझ नहीं आ रही थी कि कौन से,I didn't understand who.
सेट लूं पूरी मार्केट घूमी हूं फिर जाके,Set yourself up and go back to the market.
ली है मैंने ये अच्छा है ना बहुत खूबसूरत,I've taken this is very beautiful
है आंटी आपकी चॉइस बुरी कैसे हो सकती है,Here's how aunty can be bad about your choice.
और ये देखो ये तो बहुत ही हसीन है ये,"and behold, they are excellent!"
लहंगे के साथ कैसा,What about Lingg
लगेगा बहुत,It will be very hard
खूबसूरत ठीक है मैं फिर आपको हर चीज की,Beautiful okay I then everything you've done
लिस्ट बनाकर मैसेज कर दूंगी हां बेटा यह,"Listing list will text it, son."
ब्लैक वाले की चूड़ियां रहती,The Black Sea was a place of torment.
हंसी,[Laughing]
हैं,. . . . .
इतने प्यारे बाल है,It's so cute
तुम्हारा क्यों खराब कर रही हो कभी कुछ,Why are you ever doing something wrong?
लगाती ह हों कभी कुछ,Let her tell you something at times.
क्यों तुम्हें क्या है मेरी मर्जी जो चाहे,Why do you want to die?
लगाऊ मेरे बाल,How did I come to have a good relationship with Jehovah?
है ठीक है बाबा जो दिल चाहता है करो,"All right, let's have a heart that wants it."
तुम्हें तो साथ खून,The blood with you.
माफ,Sorry
क्यों क्यों माफ है इसलिए कि आप मुझे पसंद,Why is forgiveness because you like me
करते,Do
हैं क्या देख रहे हैं,What Are You Looking at?
ऐसे देख रहा,Looking like
हूं कितनी आसानी से कह दिया,It's so easy to say
तुम तुम्हें मेरी फीलिंग की कोई कदर नहीं,You don't appreciate my littleling.
है बड़े खुदगर्ज निकले आप आपकी फीलिंग की,It's big self-pluging you.
कदर नहीं है और आपको है दूसरों की फीलिंग,You don't appreciate and you have others' hairling.
की,of
कदर देखो जवेरिया अगर तुम आयशा की फीलिंग,"Oh, look, baby if you're pregnant."
की बात करही तो उसमें मेरा कोई कसूर नहीं,I have no blame on him for his speech.
है मैंने अम्मी को बता दिया था अम्मी की,I told Norm's
गलती है सुना कुछ और समझा कुछ,Listen to something else to explain.
बहुत ही कम सर्फ,Very low
निकले अपने बारे में क्या ख्याल,What You Think About Yourself
है मैं वह कमिटमेंट करती नहीं हूं एहतेशाम,I'm not sure she doesn't commit.
जिसे मैं पूरा ना कर सकू तो मेरी तरफ से,I can't carry it from my side.
बहुत क्लियर है मुझसे ना कोई उम्मीद मत,Don't expect me to be too late
रखना आप ही नहीं हो मैं जो दूसरों की,You're not the only one I've ever had to keep.
खुशियों के खातिर अपनी खुशियों की,Happy Despite Joy
कुर्बानी दे,Give a Sacrifice
दू,Ding
आयशा बेटा तुमने बहुत अच्छा किया तुम्हारे,You made her son very well.
आने से बहुत ढार हो गई मुझे ना य इतने,It was too late for me to come.
सारे काम मैं अकेले कैसे,All the Work - How I Have Been Alone
करती कितना रह गया ब आंटी बस थोड़ा सा गया,The aunt just went a little bit away
मुकम्मल होने वाला है आ,Come on.
जाओ बेगम साहिबा डिजाइनर मुश बीवी का,Go to queen Sensor Musshar
ड्रेस देकर गया है और दुपट्टे की दो ऑप्शन,And two osteletions of a blanket have been offered.
देकर गया है कहा है जो आपको अच्छा लगे वो,It's given you what it's like to be good.
इस्तेमाल कर लीगा अच्छा क्या वो खुद ही आ,"Well, if he'd come for his own?"
गया वरना मैं उसे कॉल करने वाली थी अच्छा,I went or I was going to call him good
तुम ऐसा करो दो कप चाय और सैंडविच दे जाओ,You do that two cups of tea and sandwich.
भूख लग गई है जब खाना तैयार हो जाए तो बता,Tell him when you're hungry
देना जी,Giving Life
अच्छा कौन सा जाएगा इसके साथ,With whom would the good go.
जी,G
आयशा बेटा जरा बताना इस ड्रेस के साथ ये,"Tell the girl a second, that's with this dress."
कौन सा दुपट्टा ज्यादा अच्छा,Which blankets are much better
लगेगा मैं हां बल्कि इधर आओ खड़ी हो उठो,I'll just get up here.
ना,N
बके लग तो रहा है मुझे एक पहन के अच्छा,So I feel good of wearing a garment
लगेगा माशा,Idle
अल्लाह इसको ओढ कर तो तुम बहुत हसीन लग,"And if Allah please, He would surely make you excellent."
रही हो बगैर मेकअप के भी यह दुपट्टा इतना,It's so covered without makeup
अच्छा लगा है,Well done.
तुम यकीनन अनुष प भी बहुत अच्छा,You're sure I'm very good.
लगेगा लेकिन आंटी वो पूरे ड्रेस की लुक तो,But aunty will look at the whole dress.
मेकअप के साथ ही अच्छी लगती है ना लेकिन,It's not good with makeup but with makeup
तुम ऐसे भी बहुत प्यारी लग रही हो पता है,You know it's like you look so sweet.
तुमहे किसका फोन आ,Which is the phone you call?
गया,Done
हेलो जी,Hello G.
कौन हेलो,Who Hello?
आपकी आवाज नहीं आ रही एक सेकंड एक सेकंड,A second second time your voice is not coming
हेलो जी,Hello G.
प्रशंसा,Praise
जी,G
तुम ये दुपट्टा तो अनुष की इंगेजमेंट का,You're on the back of the Ingement.
है तुम्हें इतना भी नहीं मालूम कि किसी की,No! You do not know.
चीज को टच नहीं करते विदाउट,Don't touch things out
परमिशन इस घर में आती हो अपनी लिमिट्स में,The gravity comes into this house in his Limitts.
रहो हर चीज में इवॉल्व होने की जरूरत नहीं,There's no need to be built up in everything.
है समझी,You got it.
तुम अश्व सर,You Black Sir
लगता है य आपकी पुरानी आदत है तकी किए,It looks like you're in your old habit
बगैर लोगों से बद गुमान होने,Without people having bad ideas
की पहली बात मुझे कोई शौक नहीं आपकी,The first thing I don't like is yours
मंगेतर की चीजों को यूज करने का आपकी,Your goal to manage the content of the object.
अम्मी ने पहनाया था तो मैंने पहना था और,I'm gonna wear it and I'm going to put it on.
अग यकीन नहीं आता ना तो जाक अपनी अम्मी से,August wouldn't believe that Zak is from his mother
पूछ,Ask
लीजिए इन चीजों की वैल्यू आपके लिए,Look at these things for you.
मेरे लिए नहीं और इन मामूली चीजों का भर,Not for me and fill these trivial things
ना किसी और को जाके दिखाएगा मुझे,Don't show me anyone else.
हंसी,[Laughing]
हंसी,[Laughing]
नहीं,No
बेगम साहिबा खाना लगवा दू हां खाना लगवा,The queen of Sheba will provide her food with a good appetite.
दो और फ्रूट राइफल फ्रिज में रखा व याद से,Two and the presidents put in the pump and remember.
रखना आयशा ने नमाज पढ़ ली होगी तो मेरे,She must have read the prayer so I could
पास भेजो,Send To
उसे बहुत प्यारी बच्ची है आ अच्छा,"She's a very sweet girl, good."
हा अच्छा आंटी अब मैं चलती,"Ha, good aunty now I go on."
हूं क्यों बेटा क्यों चलती,Why am I running the son?
हो खाना लग रहा है खाना खाकर,He's eating food
जाना नहीं आंटी मुझे भूख बिल्कुल भी नहीं,"Don't go, aunty, I don't even go hungry"
है और अम्मी भी घर पर इंतजार कर रही होंगी,And she'll be waiting at home too.
मेरा मेरी नायला से अभी फोन पर बात हुई है,I've just been talking on the phone from my flockel.
मैंने उसे बता दिया है कि आयशा खाना खाकर,I told her that she was eating
आएगी तुम परेशान मत,Don't worry.
होना आराम से बैठो खाना लग रहा है खाना,It's easy to sit down and eat.
खाकर जाना है चलो शाबाश,Let's go well.
बैठो,Sit down.
हेलो अस्सलाम वालेकुम लदा आप कैसी हैं आप,"Hello, come on. What are you like?"
आपकी तबीयत कैसी,What your circumstances permit.
है जी ठीक,"Yes, it's okay."
है मैं अभी थोड़ी देर में अश्वत को भेज,I'll send eternal life for a while.
देता हूं व ले जाएगा आपको डॉक्टर के,I give and I'll take you to the doctor.
पास बहुत बहुत शुक्रिया बहुत बहुत,Thank you very much
शुक,Shuck
खालिदा आप का फोन था तीन चार रोज से कह,She was your father's phone three days a day
रही थी कि मुझे डॉक्टर के पास ले चलो मेरे,It was going to take me to the doctor
पास वक्त ही नहीं था,He didn't have time.
अश्वत बेटा खाना खाके लदा आप को जरा,Eat eternal son-in-law and fill you up.
डॉक्टर के पास ले,Taking to the Doctor
जा क्या है बाबा लदा आंटी को हर काम के,What's up to the big aunt every job?
लिए हमें ही कॉल करनी होती है जैसे हमने,We have to call just like we.
उनका ठेका उठा रखा है बुरी बात है बेटा,"Bad it is for them to be hurt, son."
ऐसे नहीं कहते वो बेचारी बेवा है,They don't say she's poor shit.
हमारे सिवा उनका है ही,And besides Us is their portion.
कौन ममा मुझे मुझे एक जरूरी काम से जाना,Who's gonna let me go of an important job?
है मैं बस निकल रहा हूं अच्छा बेटे ऐसा,I'm just leaving this good son.
करो जाते हुए लदा आप के घर मुझे छोड़ दो,Leave me to your home loaded
मैं उन्हे हॉस्पिटल ले,I take them to hospital
जाऊंगी हा फिर तो आंटी आप जिहाद का सवाब,"If you go away, aunty will reward you for fighting"
पा,Pa_ge
लेंगी,· Global Voices
जिहाद जी आंटी हमारे नबी पाक सल्लल्लाहु,"Yes, aunty, our Prophet, has a good name for the fight."
अल वा वसल्लम की हदीस का महूम है कि जो,El Wasscher's general of Waslm is Joe
शख्स बेवा औरत की खबर गिरी रखता है या,Anyone lets news of the Beva woman fall or
उसकी जरूरियत पूरी करने के लिए भागदौड़ या,Run or run to meet her needs
जद्दोजहद करता है व मुजाहिद फी सबीला का,Composited to the left of the sym astronauts
अजर पाता है सुभान,Astrophysics
अल्लाह सुभान अल्लाह कितनी अच्छी बात की,"God, how excellent is His speech!"
है तुमने माशाल्लाह,You've got it.
से,From
शकील मैं तो आज से लदा आप के सारे काम,No doubt I loaded all of you from today
अपने हाथों से खुद,With Our Own Hands
करू,QUUGE
लबा सुन ले,Listen to a tongue
सदाए,forever
ये,That's it.
