Hindi,English
लबा सुनले,Leaf Sol
सदाए,forever
ये,That's it.
प्रशंसा,Praise
बाहर गरीबों में बांट,How do we know that God's Kingdom is the only real hope for mankind?
दो तुम दोनों को बहुत बहुत मुबारक,The two of you were very happy.
हो सानिया तुम्हें भी बहुत बहुत मुबारक हो,"Osmania, you too are blessed"
आपको,You
भी भाभी आपको बहुत बहुत मुबारक शकील भाई,Even my sister-in-law was very happy to be with you
आपको भी,You too.
मुबारक यह मुलाज में माना जी,Happy as This Well - known G.
मैम,Mem
सानिया अनुष आज से मेरी बेटी,Cynthia
हो यह तो हमेशा से ही आपकी बेटी थी भाभी,It's always your daughter-in-law.
जान बस आज से आपकी अमानत हुई,Life - Just Trust You From Today
जीती,won
रहो सलाम वालेकुम च अरे आ गई तुम आई जी,'Peace be upon you' he said. 'Peace be upon you.
अभी अभी अच्छा सुनो वोम ने अपने दोस्तों,Well listen right now he's his friends
की दावत रखी है बाकी सब तो हमने बना दिया,and We made all of them to enjoy the feast.
पर तुम्हें पता है ना कि बिरयानी हमसे,"But you know, not us."
नहीं बनती चावल संभलते ही नहीं है तो अब,Doesn't grow rice alone so now
तुम आ गई हो तो अगर तुम्हारे पास वक्त हो,"If you have any time,"
आप भी फिकर है मैं बना दूंगी तुमने तो,You're too stupid I'll make you so
मेरी मुश्किल आसान कर दी जाओ बेटा तुम थक,"Let's make it difficult for me to be tired of you, son."
गई होगी फ्रेश हो जाओ मैं तब तक चावल,I've got to be jealous I've yet rice
निकाल देती मैं बस अभी चेंज कर कर,I just want to make a change now
आती मुश्किल हल कर दी मेरी खुश रहे,I'm happy to be able to solve the problem
बच्ची भाभी,Baby-in-law
तेशाम जवेरिया को पसंद करता है और मैंने,Tion likes Javeria and I
गलत फहमी में आपसे आयशा का रिश्ता मांग,Ask for your wife's intimacy in the wrong order
लिया मैंने जब आयशा को पहली बार देखा था,I've seen her for the first time
तो उसको देख मेरे दिल में खवाहिश जा गई थी,"and behold, my heart was eager to see it."
काश इस लड़की को मैं अपनी बहू बना,"Oh, would that I had made this girl my daughter-in-law"
सकती मुझे क्या मालूम अल्लाह ताला ने मेरी,And what can I know? Allah has locked me in the lock.
इस दुआ को इस तरह से कबूल,ALSO IN THIS ISSUE
कर,Do it.
आपी आप क्या कर रही है कु नहीं बिरयानी,You don't have a fever what you're doing
बना रही थी व तेशाम नहीं उसके दोस्तों की,Being built and not having her friends
दावत है ची ने कहा कि बिरयानी बना दो बस,The feast is Chios said to be a bus
दम पर रखी हुई है तो आपने मना क्यों नहीं,Why don't you refuse if you've been executed
किया चाची को अगर तेशाम ने अपने फ्रेंड्स,Do you know how much you're doing?
को बुलाया था तो बाहर से खाना मंगवा लेता,"He called me to him, so he would call him from outside."
ना हमने ठेका तो नहीं लिया हुआ उसका वैसे,We didn't hurt her like her
तो व आपको पसंद नहीं करता काम के टाइम पर,So you don't like it at work time.
आप याद आ गई है चलो कोई बात नहीं ची ने,"You've been remembered, let's have nothing to say"
हेल्प मांगी तो मैंने कर दी इट्स,"If I did seek help, I would pay my taxes."
ओके आयशा बेटा दम आ गया बिरयानी को वो इ,"OK, daughter-in-law's son-in"
तोशाम के दोस्त आ गए हैं तो मैंने कहा,"So when the friends came, I said,"
खाना लगा दूं जी चाची बस दम पर रखी हुई है,"I want to eat, my aunt's just lying on her head."
और हां रायता और सैलेड भी बना दिया था,And [also] Yassa and Salsil.
मैंने साथ यह तो तुमने बहुत अच्छा किया,"I did it, so you did it very well."
बेटा रायता और सलाद तो मैं भूल ही गई थी,Sona and Karen I've just forgotten
आप ही तो सबके साथ अच्छा ही करती है मगर,"You are all good, but you're always good."
दूसरों को भी तो सोचना चाहिए कि वो आप ही,Others should think that he himself.
के साथ क्या कर रहे हैं चज वैसे तो आपके,What's wrong with yours if
बेटे को मेरी बहन जहर लगती है हां अब काम,"The son's poisons my sister, now job"
के वक्त में आयशा आयशा आयशा की टटर शुरू,"At the time of her pregnancy, she became pregnant as a nurse."
कर दी उसने जवेरिया मैंने तुमसे तो कोई,I've given him any of your business.
काम नहीं कहा ना जब आयशा को कोई तराज नहीं,Didn't work when she didn't have a suit?
है तो तुम क्यों बोल रही हो मगर मुझे,So why are you talking to me but I'm not here?
ऐतराज है आप ही को तो कभी किसी बात से,Ot Kingdom is the only thing you ever have.
तराज नहीं होगा उनको तो जो आप कहेंगी वो,They won't have control over what you say
खामोशी से जाके करती रहेंगी इसी बात का,Silence will keep quiet. That's what you want.
नाजायज फायदा उठा रही है ना आप चाची,"Najaz is taking advantage of you, aunty."
जवेरिया आहिस्ता बोलो नीचे मेहमान आए बैठे,The guests came down to speak softly
हैं और तुम्हारी आवाज नीचे तक जा रही है,And your voice is going down.
तो जाती है तो जाए सुनना है जिसको सुन ले,"As for him who hears and hears,"
सच बोलते हुए कैसा,How They Speak the Truth
डर,Fear
हद हो गई बदतमीजी की बहुत लंबी जुबान होती,That would have been so long sanctimony!
जा रही है इसकी जाकर लगाती हूं शिकायत,I'm going to complain about her going on.
भाभी,MEDITERRANE
को चाची बात,aunty talk
सुन क्या जरूरत चाची को नाराज करने की वाह,Listen what aunty needs to be angry.
भाई वाह यह सही है नेकी कर और दरिया में,"O my brother! That is the right thing, and that you do good in the sea."
डाल आप के लिए तो कह रही थी मैं आप,I was saying to you so
एहतेशाम ने कितना गलत किया आपके साथ आपसे,I'm so sorry you did it.
रिश्ता तोड़ दिया उसने आपको अभी भी उसकी,He broke the relationship you still had
और चाची की नाराजगी की परवा है नफरत होने,And it's about to be hated.
लगी है मुझे इन दोनों से,I've been on two of them.
एक तो इन दोनों की,One of the twos.
च अच्छा किया जो तुम आ गई मैं तुम्हें फोन,I'm gonna call you what you've come
करने वाली थी मेरा बहुत दिल घबरा रहा था,I was going to be very nervous.
इसलिए आ गई सोचा तुमसे बातें करूंगी तो,"So it came that I shall speak to you, and then I shall speak to you."
ठीक हो जाऊंगी अच्छा,I'm gonna be fine.
क्या अभी करते हैं बातें पहले मैं तुम्हें,What do you just do?
मिठाई खिलाती,Cows Corte
हूं सुरैया मिठाई ले भी आओ मिठाई किस खुशी,I'm also a sweet sweet and sweet
में पहले खा लो फिर बताती हूं किस खुशी,What joy I have in eating first?
में है,Has
ये मिठाई मैं खा लूंगी तो मुझे बताओ तो,So tell me if I'll eat this sweet.
सही किस खुशी में खिला रही हो अवद का,To what happy condition of feeding the right?
मैंने रिश्ता तय कर दिया है अनुष के,I've decided to attend.
साथ,with
क्या,What
बात इतनी परेशान क्यों हो कहां चली गई,What made the matter so upset?
थी नायला मैं तुमसे बात कर रहा,I was talking to you
हूं क्या बताऊं,What am I supposed to say?
आपको यास्मीन ने आयशा के रिश्ते की बात की,Yasmin spoke to you about her relationship
थी,was
मुझसे,From me
अच्छा तो खुशी की बात,"Happily, though, the Bible does not say that we are living in ""the conclusion of the system of things. """
है अच्छे लोग हैं इज्जत दौलत खानदान,Good People Are a Man's Family
अल्लाह ताला ने हर शय से नवाजा उन्हे फिर,"And Allah hath shut them not forth from every side, and then they have not turned aside."
और क्या,And what?
चाहिए,Needs
लायला तुम फौरन हा,I'm going to kill you immediately.
कर पहले आप मेरी बात तो मुकम्मल होने दे,Let me get the rest of what you say first.
मैंने अपने पैरों पर खुद ही कुल्हाड़ी,"I tried to get my leg on my feet, but I did not know where to go."
मारी है क्या बात,What Marie Has Done
असल में यास्मीन आयशा को बहुत पसंद करती,"In fact, Yasmin loved her"
है और वह अपने बेटे की दुल्हन बनाना चाहती,And she wants to make her son's bride
है और मेरी गलतफहमी की वजह से मेरी,And because of my misunderstandings.
बेवकूफी की वजह से मैंने आसम से कह दिया,I was surprised to learn that I had found the truth. I was surprised to learn that I had found the truth.
कि आयशा का रिश्ता तेशाम से तय हो गया,That she's settled in her relationship
है कितनी बेवकूफ हो ना मैं मेरी वजह से,Isn't it so stupid that I'm so stupid?
मेरी बच्ची का इतना अच्छा रिश्ता हाथ से,So good my daughter's relationship with me
निकल,Out
गया,Done
लायला एक बार यास्मिन से जाकर बात कर लो,Take a word from Leyea once or so.
तु अब बात करने का क्या फायदा यास्मीन ने,What advantage do you have to talk now?
अपनी देवरानी की बेटी अनुषा से अपने बेटे,Her daughter-in-law's daughter-in-law to her son
का रिश्ता तय कर,What can we do to make sure that our relationship is stable?
दिया,Given
सच बड़ा अफसोस हो रहा है मुझे इतना अच्छा,I'm really sorry so good
रिश्ता हाथ से निकल गया मेरी बच्ची कितना,How I Found My Child Out of Relationship
खुश रहती वहां,rejoicing over the loss of a loved one in death
पर,on the
जुबान देखिए तुमने उस लड़की की किस कदर,Look at how you appreciate that girl
मुंह फट है वो जो मुंह में आए वो कह देती,The mouth is torn and she says what comes in her mouth.
है मुझे जवेरिया जैसी जुबान दराज लड़की को,"It's like Janjan to me, The Golden Girl."
अपनी बहू बनाकर अपनी और तुम्हारी जिंदगी,By making your daughter-in-law and your life
अजाब नहीं करनी है अम्मी क्या हो गया अब,There's no Azimm what happened now.
जानती तो जवेरिया को बचपन से ऐसी है वो कम,I knew she was less than a child.
से कम दिल में जो बात होती है वही जुबान,At least the words in the heart are the words hypothecous
पर होती है दूसरों की तरह मुनाफ कत नहीं,but is not as effective as others are.
रखती वो दिल,She cares for the heart.
में और मुझे ऐसी ही लड़कि अच्छी लगती है,And I like such a fight.
बस वाह बेटा वाह इसीलिए कहते हैं मोहब्बत,That's just what a good son says love
अंधी होती है तुम्हारी अकल पर तो पर्दा,Lo! it is thy covering that is blind.
पड़ गया जो तुम्हे जवेरिया की खामिया भी,What happened to you to eat of Bethlehem?
उसके खूबिया नजर आ रही है अमी आप गुस्सा,She's having a bad eye. Amlly gets angry with you.
क्यों हो रही है अच्छा मेरी बात सुने एक,Listen to me good why being in a good mood.
बार मेरी उससे शादी हो जाएगी ना उसके बाद,"I'm going to get married, and I'm not going to get married again."
जैसे मैं चाहूंगा वैसे चलाऊंगा उसे और और,I'll send her and her as I want.
मैं आपसे प्रॉमिस करता हूं वो वो आपके साथ,I'll argue with you he's with you.
बदतमीजी नहीं करेगी हरगिज नहीं,Unprejudicious won't defeat
करेगी अम्मी अम्मी,Immmma
प्लीज आप ताई जान और ताया जान से बात करें,Please speak to the Hai Soul and the Tata
ना प्लीज मेरी,Please don't stop me.
खातिर,Fort
प्रशंसा,Praise
प्रशंसा,Praise
क्या हुआ यहां क्यों बैठी है आप,What's sitting here is why you sit here?
ऐसे नींद नहीं आ रही,It's not going to sleep.
बेटा बहुत,Too much son
बेचैनी कभी कभी गलत,"In some cases, it may be wise to ask yourself, "" Is there any way I can cope with this situation? '"
फैसले पछतावा बनकर आपका सुकून छीन लेते,It would be a relief to make decisions that would relieve your sadness.
हैं,. . . . .
इंसान को अपना हर फैसला अल्लाह पे छोड़,Let the human decide on what he wants.
देना चाहिए ना अर अल्लाह ने उसकी तकदीर,Allah should not give him his fate
में कुछ लिखा है तो वो उसको मिलके,I've got something in it so he's gonna get it.
रहेगा फ अल्लाह ने उसकी तकदीर में जो नहीं,Allah has not decreed its destiny.
लिखा वो लाख कोशिश भी कर ले उसे नहीं,Write he don't even try a million.
मिलेगा मुझे तुम्हारी बहुत फिक्र है बेटा,"I'm worried about you, son."
तुम मेरी बहुत प्यारी बेटी,You love my dear daughter.
हो मगर क्या,What the hell are you doing?
करू,QUUGE
अफसोस लोग तुम्हारा बातन नहीं जाहिर देखना,Sadly people don't see you clearly
चाहते,User ID:
हैं आप लोगों की परवाह करना छोड़ दे ना,Are you giving up caring for people?
मैंने कहा ना आपसे कि अल्लाह ने मेरे नसीब,"I said to you, ""God has given me my fortune."""
में जो लिखा है मुझसे कोई नहीं छीन सकता,No one in what's written
मुझे अला की सात में पूरा,Complete me in the seven of Ala's
भरोसा मैं आज कल सूरत आल इमरान की तफसीर,"I'm confident today, I'll take refuge in Al-Alefsin."
और तर्जुमा पढ़ रही,And Albert Reading.
हूं उसकी एक आयत का महूम,One of his verses is Mahum
है अगर अल्लाह तुम्हारी मदद,"And if Allah helps you, then there is no help for you."
करे तो कोई भी तुम पर लिब नहीं हो,If he doesn't go on you
सकता अगर वह तुम्हें छोड़ दे,Maybe if he leaves you
उसके बाद कौन री मद,Then who Renew item
कर ईमान वालो को अल्ला पर भरोसा करना,"And trust those who believe in Ahilah (i.e. Prophet Muhammad SAW, the Quran, and Prophet Muhammad SAW)."
चाहिए जिस दिन से सरत पढ़ रही,Should the day be reading from the past
हूं ना दिली सुकून मिल रहा है,I have peace of heart.
मुझे ऐ जैसे के हसला सा हो गया जिंदगी,Life's turned out to me like Aila Hasla
में अल्ला पर भरोसा बहुत बड़ी नेमत है,Trusted in Babylon is a great blessing.
ना उमी,Nahi
ना पर यकीन रख,Do not be convinced.
आप अल्ला मेरी बच्ची का नसीब अच्छा,You good my baby-in-law's fortune.
करे,Do it.
उठे बहुत देर हो गई,The waked up was too late
है कुछ नहीं सोचना है,Has Nothing to Think
आपने किसी चीज परेशान नहीं होना आपने सब,You have nothing to worry about.
ठीक हो जाएगा ठीक है,It'll be okay.
तुम्हारे घर वाले इतना प्यार और मोहब्बत,So much love and love are in your house
करते हैं मुझ मुझे जाने ही नहीं देते,Don't let me go
क्योंकि उन्हें पता नहीं है कि कितने,Because they don't know how much
खतरनाक आदमी हो तुम और किसी खास मकसद से,You're a dangerous man and for some particular reason.
आए हो हा,Come on.
वैसे मकसद तो काफी,So Much to Purpose
खास आप ना मेरे चचा का पीछा छोड़,Special you left after my uncle
दे मैंने आपके लिए एक बहुत अच्छा ता ढूंढा,I've found a very nice look for you.
लगता है आज ईद का चांद दोपहर में निकल आया,It looks like the dinner moon got out at noon.
ईद का चांद तो नहीं निकला लेकिन बहुत जद,The date did not contain but was too late
तुम्हे दिन में तारे नजर आने,You see the star in the day.
वाले अल्हम्दुलिल्लाह मैं बिल्कुल ठीक ठाक,A girl named Alanda I've made it all right.
नायला तुम बहुत खुशनसीब हो अल्लाह ने,God has made it easy for you to rejoice.
तुम्हें दो बेटियां दी आप मुझे ही देखो,You give me two daughters
अकेली सारा दिन काम करती हू,She worked all day long.
सच पूछो तो बेटी की कमी बहुत शिद्दत से,"Indeed, the girl's loss is too great"
महसूस होती है मुझे इतने सारे काम पड़े,I feel that I have so much work to do
हुए हैं ख ही नहीं दे र मैं तो अकेली काम,I'm not alone if I work alone
कर कर के थक गई हूं अब अब तुम्हें तो पता,I'm tired of doing it. Now you know you're gonna know.
है मंगनी के फंक्शन के इतने काम होते हैं,There are so many functions of an engagement function
सारे काम मुलाजिमों से तो नहीं करवाए जा,All the work has not been accomplished by natives
सकते ना काश मेरी भी बेटी होती तुम इतना,You couldn't have been so much my daughter
परेशान क्यों हो रही हो यासमीन तुम कहती,Yasmin says why you're upset.
हो तो मैं आयशा और जवेरिया को भिजवा देती,Then maybe I'll get her and get her in..
हूं मेरी बच्ची भी तो तुम्हारी ही बेटी है,"I'm my daughter too, your only daughter."
ना सच कह रही हं नायला अगर तुम ऐसा कर,"No, it's not true if you do that."
दोगे ना कसम से मेरे बहुत सारे मसाइल हल,You won't swear it to me by a lot of Massilells.
हो जाएंगे काफी काम निबट जाएंगे मैं समझ,We're going to have a lot of work to do. I'll understand.
सकती हूं बहुत काम होते हैं चलो मैं आयशा,"Let's do a lot of things, I'll have her."
से कहती हूं ऑफिस के बाद वो तुम्हारे पास,Let me tell you what that's after the office.
आ जाएगी और जवेरिया को मैं तुम्हारे पास,And I will come to you to Bethlehem.
अभी भेजती हूं थोड़ी देर,I'll send you a while
में तुम फिक्र मत करो सब ठीक हो जाएगा,"Don't worry about it, it'll be all right."
इंशाल्लाह,Insurgent
चलो ठीक है बहुतबहुत शुक्रिया,Let's go thank you very much.
चलो ठीक है खुदा,Let's go Allah's right.
हाफिज आयशा जीमी बेटा और जवेरिया अमी,HIFIZE GMILAND AND JARIE AILA
प्लीज सारी बातें सुन ली हमने आपकी मैं व,Please hear all the words. We have listened to you and I.
